{
  "id": "quantum-tanner-autoresearch",
  "title": "Quantum Tanner Autoresearch",
  "objective": "Evaluate quantum Tanner fixture candidates with upper-bound screening inputs before rbposd p=0.001 runs.",
  "family_id": "quantum-tanner-code",
  "default_suite_id": "quantum-tanner-rbposd-p001-v1",
  "budget": {
    "wall_clock_seconds": 3600,
    "max_candidates": 3
  },
  "stop_conditions": {
    "max_candidates": 3,
    "max_wall_clock_seconds": 3600
  },
  "random_seed_policy": {
    "mode": "fixed",
    "seed": 7
  }
}
