{
  "budget": {
    "max_candidates": 1,
    "wall_clock_seconds": 900
  },
  "default_suite_id": "bb72-qldpc-campaign-v1",
  "family_id": "bivariate-bicycle-code",
  "id": "bb72-qldpc-campaign",
  "objective": "Run the paper-backed BB72 bivariate-bicycle qLDPC seed through the M2 search pipeline.",
  "random_seed_policy": {
    "mode": "fixed",
    "seed": 7
  },
  "stop_conditions": {
    "max_candidates": 1,
    "max_wall_clock_seconds": 900
  },
  "title": "BB72 qLDPC Campaign"
}
